quests_title,quests_description,quests_objective
The Call,"You are on the trail of the lost artifacts of Tulak Hord, which are believed to be key to a secret ritual that will grant you great power.
Darth Zash has traced one of these artifacts to Nar Shaddaa. Travel to Nar Shaddaa and contact Darth Zash via your ship’s holoterminal to learn more about its whereabouts.",Travel to Nar Shaddaa
The Enemy of My Enemy,"You’ve received instructions to travel to Nar Shaddaa to continue the Great Hunt.
Use your ship’s galaxy map to travel to the planet Nar Shaddaa.",Travel to Nar Shaddaa
The Loudest Bait,"Foreman Meropta at Camp Lytle is trying to get a pipeline built to bring in the water supply from the Lower City Hydro Station. The explosives are already in place, but his men have been driven out by tremor maw attacks.
You’ve agreed to detonate the explosives yourself. Use the explosives in the Tularan Marsh to draw out the tremor maws and kill them.",Defeat Tremor Maws
The Power Guard Project,"General Var Suthra wants you to meet Agent Galen on Nar Shaddaa.
Take your ship to the Deucalon Spaceport on Nar Shaddaa, then contact General Var Suthra on the holoterminal for more details.",Travel to Nar Shaddaa
The Prophet Arrives,"The artifact of Tulak Hord on Nar Shaddaa is in the hands of the Sith cult leader, Lord Paladius.
Darth Zash has arranged a contact for you, Destris Veran, who was once a follower of this cult. Rendezvous with him at the Promenade to plan your overthrow of Paladius.",Meet with Destris Veran
The Thrill of Discovery,"Tarkos Sund is looking for an engine accelerator used in swoop races on ancient Taris. He believes the engine can be updated and repurposed into today’s technology. His search has hit a roadblock, however, as beasts are preventing him from reaching the ancient swoops.
You have volunteered to find the remnants of a swoop bike for him. Explore the Tularan Marsh and scan swoop bikes until you find an engine accelerator.",Scan Derelict Swoop Bikes
Vanquishing the Vanguard,Watcher One has placed a vanguard of Imperial forces between you and Doctor Godera as a final delay tactic. Defeat the Imperial forces within the outpost and get to Doctor Godera.,Eliminate Imperial Forces
What You Do For a Partner,"Kaliyo has asked for your help in tracking down Anspi’shel, her old partner-in-crime. Anspi’shel is in trouble with the Exchange on Nar Shaddaa, and Kaliyo has decided to rescue her.
Travel to Nar Shaddaa using your ship’s galaxy map.",Go to Nar Shaddaa
Witness Prevention,"The auction ended in violence as you blasted the Black Sun, Hutt Cartel and swoop gang leaders. Now their followers are angry and out for your blood.
Eliminate the gang forces to ensure there are no witnesses left to discuss the details of the auction.",Defeat Gangsters
[HEROIC 2+] The Republic’s Last Gasp,"The Republic have been driven off Balmorra, but three of their most capable and dangerous fighters remain and are re-arming the resistance.
Defeat the Jedi Noth Armin, Sergeant Tove Weylan, and Korin Norrus in the Markaran Plains.",Defeat Jedi Noth Armin
[HEROIC 2+] Toxic Bombs,"The resistance has started building deadly toxic bombs out of the toxic waste in the toxic pools.
Disable the toxic bombs.",Disable Toxic Bombs
[HEROIC 4] Ravaged Reconstruction,"Mandalorians have taken demolition droids and large bombs to the top of the unfinished “New Tarisian Dawn” skyscraper in the Sinking City and are using them to destroy the building. Veldo Balesh views the building as a symbol of the Tarisian reconstruction effort and wants you to stop the Mandalorians and their bombs.
To deactivate the Mandalorians’ bombs, you’ll need an ion discharger device. Locate one near the generator on the main level of the New Tarisian Dawn construction site.",Collect an Ion Discharger
[HEROIC 4] Secret Business,"Sennegrin Coops, a boss in Sobrik, has recently lost a shipment of important supplies to raiders in the Gorinth Canyon. You’ve agreed to help him recover them. Coops’ assistant, Treezl Zillyons, should have more information as to the last known whereabouts of the supplies.
Speak to Treezl Zillyons at the Fillarik Arms and Demolitions shop in the Sobrik.",Speak to Treezl Zillyons
A Crushing Blow,"Agent Maro Vizhen is responsible for gathering allies from Nar Shaddaa’s criminal organizations for the Empire. However, Ukabi, the local leader of the Exchange, refuses to join.
Maro Vizhen has tasked you with making an example of Ukabi by crippling his operations. Destroy Ukabi’s chemical refineries and arms caches in the Agrilat District of the Corellian Sector.",Destroy Ukabi’s Arms Caches
Absolute Terror,Return the Master Detonator Switch to the Mission Terminal.,Turn in Master Detonator Switch
Armed and Dangerous,"You’ve joined forces with Republic Ambassador Averdon and Bareesh the Hutt to stop the violent Kintan Kings gang. Bareesh revealed that the spaceport attack on Minister Plennid was a diversion to hijack a Republic freighter transporting powerful combat implants. The Kintan Kings are now distributing these deadly upgrades to their gang enforcers.
Recover the combat implants before the Kintan Kings inflict even greater harm. The stolen shipment was taken to a location in the Nikto Sector.",Recover Stolen Combat Implants
Balmorra: Bonus Series,"In order to destroy the resistance at Darth Lachris’s request, speak to Colonel Proshen at the Remote Markaran Outpost.",Speak to Colonel Proshen
Bled Dry,"The Bleeders are an infamous criminal gang who have been brtually victimizing Republic citizens, possibly at the Empire’s secret request. You’ve inflicted significant damage on the Bleeder gang and obtained a biological sample that proves the gang is working with Gene Corp to distribute spice in Republic space by mixing it with medical supplies.Deliver this proof to the authorities and put an end to this criminal enterprise.
Deposit the vial of Bleeder Blood into the mission dropbox near Malahan in the Red Light Sector.",Deliver Vial to Mission Dropbox
Bringing Up the Rear,"In order to draw Lord Rathari into a confrontation, you have set out for Outpost Shylon to destroy one of his operations, which is currently in effect. Entering Outpost Shylon, deal with any Imperial rear guards you come upon.",Defeat the Imperial Rear Guard
Cleansing The Spice Trade,"Malahan, a recovering spice addict, informed you the Hutts are using spice labs to manufacture and sell addictive substances on Nar Shaddaa. Malahan wants you to destroy the distribution network so the dealers won’t have anything to sell the addicts in the Red Light Sector.
Destroy the spice lab equipment in the Red Light Sector.",Destroy the East Lab in the Transit Hub
Clearing The Vault,Defeat the supporters of Kata the Hutt’s Pit Fighting arena,Defeat Vault Pit Fighting Supporters
Closing the Deal,"You have received instructions to travel to Nar Shaddaa as part of your mission to eliminate the Eagle’s galaxy-spanning terrorist network. The Eagle is already responsible for thousands of civilian deaths and the assassination of Darth Jadus; his forces must be stopped before they do further damage to the Empire.
Use your ship’s galaxy map to travel to Nar Shaddaa.",Defeat Enhanced Gangsters
Colicoid Expulsion,"Captain Augatta needs to drive the mutated Colicoids from Bugtown.
Mark toxic-shell bombardment target locations at Bugtown.",Mark the Colicoid Sol Nest
Colicoid Feast,"Captain Neuwt has lost good soldiers to the growing menace of the Balmorran Colicoids.
In an attempt to counter the ravenous spread of these creatures, he has devised a gruesome plan to cut up and poison the bodies of his fallen troops. He wants you to place these poisoned body parts at the Colicoid feasting mounds in Bugtown.",Deposit Poisoned Body Parts
Contract Negotiations,"Your mission to eradicate the Eagle’s terrorist network brings you to Nar Shaddaa, a lawless moon run by corporations and street gangs. Here, you must neutralize the terror cell distributing the dangerous Cyclone serum.
You acquired a Cyclone sample for your partner, Watcher X, but he lacks the equipment to analyze it. Take a speeder to the Duros Sector and use the bioscanner at Mutotech Labs to continue your investigation.",Slice the North Public Terminal
Crackdown at Club Ufora,"Club Ufora’s owner and its staff are hiding something, but in order to find out what’s in the back room, you will need to take care of Club Ufora’s bouncers.",Defeat Club Ufora Bouncers
Cripple the Kings,Deliver the medallion to the Mission Dropbox near Yeddu in the Nikto Sector.,Deliver Medallion to the Mission Dropbox
Curing The Rot,"The artifact of Tulak Hord on Nar Shaddaa is in the hands of the Sith cult leader, Lord Paladius. You’ve decided that the best course of action is to draw Paladius’s followers away from him. To that effect, you’ve determined that the best way to make a name for yourself and garner some support is to cure the disease known as “the Rot,” which plagues the poor.
Tydis Neutronics has the cure; you’ll have to steal it. Break into the Tydis Neutronics Warehouse in the Corellian Sector.",Infiltrate the Tydis Neutronics Warehouse
Dead Drop,"Madel Felth has informed you that an alien called “the Flame” has arrived on Nar Shaddaa and united the alien refugees of the area against the Empire. Madel’s inside agent was discovered and killed, and his body put on display.
Madel needs you to go to Umbarra Plaza in the Duros Sector where her agent’s body is on display. Recover the agent’s report from his body, and use combustible chemicals to dispose of his remains.",Loot the Report and Dispose of Agent’s Body
Deadly Droids,"Radical anti-Empire extremists are attacking loyal citizens. The extremists are rigging astromech droids with explosives and sending them on bombing missions. The Empire wants these droids destroyed, and the anti-Empire extremist leader eliminated.
Destroy all droids at Duros Plaza.",Destroy the Rigged Astromech Droids
Disrupt Negotiations,"In order to eliminate Darth Baras’s former spy, Agent Dellocon, you must draw his protector, Lord Rathari, into a confrontation by destroying all of his operations.
Your contact, Halidrell Setsyn, has informed you that Lord Rathari is strong-arming the Hutt Cartel out of some territory. Interrupt Rathari’s negotiations at the Hutt Cartel safe house in the Duros Sector.",Return to Halidrell Setsyn
Double Negative,"While investigating the disappearance of Republic fleet officers in the Red Light Sector, you discovered Lieutenant Rale was held captive in the back room of Club Ufora. He informed you that he and the other officers were taken captive and smuggled out of the club one by one. He’s only seen one officer since then, and the man “wasn’t the same” after returning.
Lieutenant Rale believes the other Republic officers are being held in the Quarantine Zone. Search for the other missing Republic officers there.",Return to Ilox
Economic Boom,"Your target for the Great Hunt on Nar Shaddaa is the elusive assassin known as “The Eidolon.” Gele’ren, a lieutenant for the Hutt Cartel, thinks that the best way to get the Eidolon to come out of hiding is to disrupt his business and make yourself a target.
Place the explosives on the three power generators inside Eidolon Armaments in the Corellian Sector.",Defeat the Eidolon Security Team
Eliminate the Exchange Dock Hands,Defeat Exchange Dock Hands,Defeat Exchange Dock Hands
Eyes and Ears,"Godoba the Hutt claims the Exchange has implanted surveillance devices in the feral creatures that stalk Nar Shaddaa’s back alleys. Godoba has demanded these creatures be exterminated.
In the Corellian Sector, slay the Exchange Cyber-beasts and take the surveillance devices implanted in their bodies.",Retrieve Surveillance Devices
Fall of the Kings,Deliver The Mountain’s Contact List to the Misssion Dropbox on the Promenade.,Deliver The Mountain’s Contact List to the Drop Box
Final Stage – Bled Dry,"The Bleeders are an infamous criminal gang who have been brutally victimizing Republic citizens, possibly at the Empire’s secret request. You’ve inflicted significant damage on the Bleeder gang, but fresh reports indicate the Bleeders are distributing spice to Republic worlds by mixing it with biological samples sent to Gene Corp medical clinics. Find the Bleeder’s liasion to Gene Corp and obtain a biological sample that proves this rumor’s truth.
Collect a vial of Bleeder Blood from the Bleeder Street Captain in the Red Light Sector on Nar Shaddaa.",Retrieve a Vial of Bleeder Blood from the Gene Corp Liaison
Final Stage – Cripple the Kings,Recover the Kintan Kings medallion from the Kintan Ringleader in the Nikto Sector on Nar Shaddaa.,Retrieve the Kintan Kings Medallion from the Kintan Ringleader
Final Stage – Fall of the Kings,Defeat the Mountain in the Kintan arena and take his list of criminal contacts.,Retrieve the Mountain’s Contact List
Final Stage – Sending a Message,Disable the Exchange’s Refineries Control System in the Corellian Sector.,Disable the Control System
Final Stage Absolute Terror,Retrieve the Master Detonator Switch from the Anti-Empire Mastermind.,Retrieve Master Detonator Switch
Handling the Situation,You are pursuing creatures in Nar Shaddaa’s back alleys that may have surveillance devices implanted in them. Take out any Exchange beast handlers you encounter in the Coronet District of the Corellian Sector.,Defeat Ukabi Beast Handlers
Imperial Lab Raid,"The Empire has hidden a medical complex in the Red Light Sector’s quarantine zone. Whatever the enemy is up to here, it isn’t good.
Clear the medical complex of Imperial forces.",Defeat Lab Security
Let the Vendor Beware,"An informant named Ghost reports that the local Krayt gang has sliced into Imperial databases and stolen several top secret reports, hoping to sell them to the highest bidder.
It would be in the Empire’s best interest to recover the reports and ensure they’re returned to Imperial Intelligence. Find the Krayt gang slicers in the Corellian Sector and defeat them to retrieve the reports.",Recover Sliced Reports
Making Them Pay,"While planting baradium charges inside Eidolon Armaments, take out the Eidolon’s security forces to do extra damage to his operation. Eliminate the Eidolon’s officers, guards and security droids inside Eidolon Armaments in the Corellian Sector.",Defeat the Eidolon’s Security Forces
Manufacturing Miracles,"The artifact of Tulak Hord on Nar Shaddaa is in the hands of the Sith cult leader, Lord Paladius. You are well on your way to establishing your rival cult.
Rylee Dray has secured a new base for your followers, a former shelter known as Strell House. Go to Strell House on the upper level of the Promenade, and meet with her and Destris Veran to plan your next move.",Meet Destris and Rylee
Maximum Yield,Some of the more volatile munitions at Eidolon Armaments are housed in special blast-resistant cases that may survive a baradium blast. Unsealing the cases should expose the contents to the explosion.,Open Blast-resistant Cases
Nar Shaddaa Landing,"According to Risha, you have business waiting on Nar Shaddaa that will bring you one step closer to finding Nok Drayen’s lost fortune.
Travel to the planet Nar Shaddaa by plotting a course on your ship’s galaxy map. Once you’ve landed there, speak to Risha for more information.",Travel to Nar Shaddaa
One Fell Swoop,"A local Nikto named Yeddu has told you the tale of how his neighborhood used to be a great place to live until the swoop gangs moved in. They killed his brother for not paying them protection money, but now Yeddu has a way to get back at them.
Yeddu hired you to disable the gang’s swoop bikes permanently with EMP charges. Plant the EMP immobilizers on the Burning Tu’kata and Kintan Kings’ swoop bikes in the Nikto Sector.",Disable Kintan Kings’ Swoop Bikes
Party Crasher,"Risha explained that Drooga the Hutt will trade the male shanjaru beast in your cargo hold for one of the keys needed to claim Nok Drayen’s lost fortune.
An alien named Gozubb informed you that Drooga took his pleasure barge to the crime-ridden Nikto Sector. You’ll have to brave this gang-infested territory to arrange your deal.",Go to the Nikto Sector
Power Guard Infiltration,"While investigating the Power Guard Cybernetics Lab you have discovered an Imperial presence.
Defeat the Imperial Soldiers in the area.",Defeat Imperial Forces
Privileged Information,"You’ve found a datapad that contains inside information on the Exchange. The owner had to abandon the datapad, but the Hutts would pay good credits for this information.
Take the datapad to a secure terminal at Imperial Outpost Drazaal in the Duros Sector and upload the information to the Hutts.",Upload Data to the Secure Terminal
Put Down the Riot,The Flame has convinced the aliens living in the Duros Sector to start a riot. This is bad for the Empire’s business interests in the area and needs to be put down quickly. Defeat any alien rioters at Umbarra Plaza in the Duros Sector.,Dispatch Alien Rioters
Putting Down the Stardogs,The Stardogs and the Exchange are meeting to discuss the best way to take you down. Take them out before they get the opportunity. Eliminate Stardog forces and Exchange gang members in the Corellian warehouse.,Defeat Exchange Conspirators
Reaching Out,"On Nar Shaddaa, you’ve been assigned to work with an SIS operative named Jonas Balkar to stop a renegade Republic battle droid called M1-4X. The droid is tied to the Havoc traitors, but it doesn’t seem to realize that its masters have defected to the Empire.
Since the droid escaped your first attempt to capture it, Jonas Balkar is making plans to track it down. Meet with Jonas Balkar in his abandoned warehouse hideout in the Red Light Sector.",Rendezvous with Jonas Balkar
"Red Light, Black Heart","You are on Nar Shaddaa to lock down the Power Guard project and find Agent Galen. You’ve discovered that Agent Galen was captured and taken to the Power Guard Cybernetics Lab.
Go to a quiet spot in the Red Light Sector and contact Chief Rieekan via holo to update him on the mission.",Go to the Red Light Sector
Running with the Lancers,"Tharan Cedrax has agreed to help you track down Master Duras Fain, who is leading the “Guiding Hand” cult. He believes that infiltrating the Red Light Lancers, a local tech gang, might get you closer to Fain.
The Red Light Lancers have been asking Tharan to do a special job. Tharan is sending you in his place to try and convince them to help. Head to the Red Light Lancers’ safe house in the Red Light Sector.",Go to the Lancers’ Safe House
Salting the Fields,"Captain Ardmore has informed you that resistance patrols are desperate for food supplies and are gathering crops in the area. Retaking the farms is no longer an option, so the crops must be destroyed to disrupt the food supply chain for the resistance.
Recover the soil devastators from the bodies of the soldiers in the Markaran Plains.",Recover RK-9 Soil Devastator
Seek Your Contact,"You have been instructed to travel to Nar Shaddaa. Upon arriving on Nar Shaddaa, contact Darth Baras on your ship’s holocom for details on the assignment there.
Use your ship’s galaxy map to travel to the planet Nar Shaddaa.",Travel to Nar Shaddaa
Send Ukabi a Message,Maro Vizhen doesn’t only want Ukabi’s assets destroyed–she wants his armies decimated. Take out any of Ukabi’s forces you find guarding his chemical refineries and arms caches in the Agrilat District of the Corellian Sector.,Defeat Ukabi’s Forces
Sending a Message,Deliver the Amulet to the Mission Dropbox outside the Shadow Syndicate Safehouse in the Corellian Sector.,Deliver the Amulet to the Mission Dropbox
Shore Leave,"A private investigator named Ilox witnessed a number of Republic officers entering Club Ufora. They never left. While investigating their disappearance, he saw armed guards and slave cages in the club’s back room. Ilox suspects the Republic officers are being held prisoner.
Ilox asked you to enter the Club Ufora cantina in the Red Light Sector and locate the missing Republic officers.",Investigate Club Ufora
Shut Down the Slave Market,"You’ve managed to infiltrate a hidden slave market beneath the streets of the Nikto Sector. From here, dozens of kidnapped Republic citizens are bought and sold daily. End this atrocity by eliminating the Kintan Kings slavers in the abandoned casino beneath the Nikto Sector.",Defeat Slave Market Kintan Kings
Silence in the Listening Post,Officer Keeling has tasked you with silencing the hidden Republic listening post in the Corellian Sector. Ensure you are thorough and defeat any SIS forces you find there.,Dispatch SIS Forces
Slave Raiding,"You’ve joined forces with Republic Ambassador Averdon and Bareesh the Hutt to stop the violent Kintan Kings gang. These vicious criminals operate a slave market at an abandoned casino in the Nikto Sector. Many of the slaves are kidnapped Republic citizens!
Free the kidnapped Republic citizens at the Fate’s Hand Casino in the Nikto Sector.",Free Kidnapped Republic Citizens
Slay the Enhanced Soldiers,"Ukabi has been developing a prototye “supersoldier” formula for use on his thugs. While you’re destroying his equipment, make sure you eliminate any Enhanced Soldiers you encounter at Ukabi’s lab in the Corellian Sector.",Defeat Exchange Enhanced Soldiers
Slicing Through the Krayts,"The Krayt gang is holding on to valuable data, Show them that this will not be tolerated. Eliminate the Krayt slicers, goons and brutes in the Corellian Sector.",Defeat Krayt Gang Members
Stage 1 – Bled Dry,"The Bleeders are an infamous criminal gang who control all manner of illicit commerce in the Red Light Sector, from spice distrubution to black market bio-harvesting and murder-for-hire. The Bleeders have been brtually victimizing Republic citizens entering their territory, possibly at the Empire’s secret request. It’s time someone put a stop to these attacks.
Take out any Bleeder gang members in the Red Light Sector on Nar Shaddaa.",Defeat Bleeders
Stage 1 – Cripple the Kings,Take out any Kintan Kings you find within the Nikto Sector on Nar Shaddaa.,Defeat Kintan Kings
Stage 1 – Fall of the Kings,Dispatch any Kintan Kings within the Kintan arena in the Nikto Sector of Nar Shaddaa.,Defeat Kintan Kings
Stage 1 – Sending a Message,Defeat Exchange forces within the Corellian Sector.,Defeat Exchange Forces
Stage 1 Absolute Terror,Defeat Anti-Empire militants in the Duros Sector.,Defeat Anti-Empire Militants
Stage 2 – Bled Dry,"The Bleeders are an infamous criminal gang who control all manner of illicit commerce in the Red Light Sector, from spice distrubution to black market bio-harvesting and murder-for-hire. The Bleeders have been brtually victimizing Republic citizens entering their territory, possibly at the Empire’s secret request. It’s time someone put a stop to these attacks.
Take out any Bleeder gang members you find in the Red Light Sector on Nar Shaddaa.",Defeat Bleeders
Stage 2 – Cripple the Kings,Take out any Kintan Kings you find within the Nikto Sector on Nar Shaddaa.,Defeat Kintan Kings
Stage 2 – Fall of the Kings,Dispatch any Kintan Kings within the Kintan arena in the Nikto Sector of Nar Shaddaa.,Defeat Kintan Kings
Stage 2 – Sending a Message,Destroy the Exchange’s Power Conduits within the Corellian Sector.,Destroy Exchange Power Conduits
Stage 2 Absolute Terror,Destroy the Bomb Parts in the Duros Sector.,Destroy Bomb Parts
Stage 3 – Bled Dry,"The Bleeders are an infamous criminal gang who control all manner of illicit commerce in the Red Light Sector, from spice distrubution to black market bio-harvesting and murder-for-hire. The Bleeders have been brtually victimizing Republic citizens entering their territory, possibly at the Empire’s secret request. It’s time someone put a stop to these attacks.
Take out any Bleeder gang members you find in the Red Light Sector on Nar Shaddaa.",Defeat Bleeders
Stage 3 – Cripple the Kings,Demolish the Kintan Kings’ swoop fuel cells within the Nikto Sector on Nar Shaddaa.,Destroy Fuel Cells
Strike the Mountain Asunder,"You’ve joined forces with Republic Ambassador Averdon and Bareesh the Hutt to stop the violent Kintan Kings gang. The gang’s leader, a hulking brute called “the Mountain,” demanded you come to his base–or he will detonate the explosives planted in Deucalon Spaceport and kill countless innocent people.
Confront the Mountain at his base in the Nikto Sector.",Find the Mountain
Tearing Apart the Foe,"Despite your efforts to weaken him, Ukabi refuses to ally himself with the Shadow Syndicate.
He is planning a massive counterattack, so you must strike first. Begin by defeating Ukabi’s lieutenants within his headquarters in the Corellian Sector.",Defeat Tanith
The Exchange Death Squad,"Ukabi is not one to roll over and die easily. He is planning a counterattack on civilians using death squads he has flown in from off-planet.
Intercept Ukabi’s death squads at the Exchange docks in the Corellian Sector and destroy their ships.",Defeat Exchange Kill Squad Forces
The Krayt Gang,"The artifact of Tulak Hord on Nar Shaddaa is in the hands of the Sith cult leader, Lord Paladius. You’ve decided that the best course of action is to draw Paladius’s followers away from him.
To that effect, you’ve determined that the best way to make a name for yourself and garner some support is to take out the leader of the notorious Krayt gang. Head to their hideout in the Corellian Sector and prepare for a fight.",Infiltrate the Krayt Gang’s Hideout
