quests_title,quests_description,quests_objective
Wipe Out the War Camp,"You have been tasked with retrieving bomb defusal codes from a House Ulgo war camp. The camp is heavily fortified and filled with soldiers. Clearing it out would strike a real blow against the Ulgos.
Defeat Ulgo War Camp Forces in the Glarus Valley.",Defeat Ulgo War Camp Forces
[HEROIC 2+] Reinforcements,"Sith apprentice Fannatex and his master came to Alderaan to search for a Jedi Master aiding House Organa. During their search, Fannatex’s master was overcome by Advozsec mercenaries, specially trained to kill Sith. Fannatex has asked you to wipe out these mercenaries, as well as the Jedi Master who trained them.
Find and slay the Advozsec mercenaries and their Jedi Master guardian at the Fornaak Falls Cavern in the Kaamos Territory.",Defeat the Jedi Master
[HEROIC 2+] Shock Doctrine,"Lord Malichose wants to shock House Organa into attacking House Ulgo. To that end, he has asked you to travel to a nearby Jedi and Organa encampment, slay all who reside there, and plant evidence on the corpses implicating House Ulgo in the attack.
Take a taxi to the Elysium Recon Camp, slay Organa and Jedi Forces, and plant Ulgo Medallions on their bodies.",Plant Evidence on Organa and Jedi Corpses
[HEROIC 2+] The Mountain’s Eyes,"Tenantius Thul’s riders have spotted Organa probe droids in the mountains. He needs to know how much the Organas have discovered about the Thuls’ defenses.
Destroy the Organa probe droids in the Eastern Alsiri Pass and obtain their memory cores.",Collect Organa Probe Droid Memory Cores
[HEROIC 4] Insufficient Staff,"Sergeant Tegan has asked you to help kidnap Padrus Organa. He wants you to create a diversion in the Alde compound so he and his men can reach their target undetected.
Trigger the Alarm Console inside the House Alde Hangar in the Juran Mountains.",Activate the Alde Bunker Alarm
[HEROIC 4] Red Handed,"Samara Organa needs you to recover a very sensitive cache of evidence that will reveal Senator Gaul Panteer’s murderer.
Access the Master Archive Terminal in the holoarchives at Castle Panteer.",Access the Master Archive Terminal
[HEROIC 4] Spring Thaw,"Corporal Lanoyo sent some Thul nobles to investigate a crashed Organa transport ship, but they have not returned. He has asked you to find out what happened to them and what cargo the Organa transport was carrying.
Head to the transport ship crash site and investigate the transport crates.",Investigate the Crash Site
[HEROIC 4] Survivors,"Elz Organa is on a crusade to free Organa citizens captured by Killiks at the abandoned Syrush estate. If you can defeat the Killiks holding the Organa citizens hostage, Elz will make sure they get to safety.
To free the Organa captives, defeat the Killik Siege Forces surrounding them at the Farmsteads near the abandoned Syrush estate in King’s Pass.",Free Organa Captives
[HEROIC 4] Turning the Tide,"Dolin Organa has warned of an impending Killik invasion threatening the region known as King’s Pass. The Killiks have already overrun the nearby abandoned estate of House Syrush, and they will reach the Wardpost soon unless something is done to stop them.
Thin the numbers of the Killiks laying siege around the abandoned Syrush estate in King’s Pass, and collapse their burrows to prevent them from summoning reinforcements.",Defeat Killik Siege Forces
A Family Matter,"The Taris Blacklist bounty is a Mandalorian exile named Jicoln Cadera. Bloodworthy suggested talking to the local Mandalorian leader, Commander Fett, for any possible leads.
Travel to the Mandalorian camp north of toxic lake garrison and see what Commander Fett has to say.",Speak with Commander Fett
A Friendly Wager,"You’ve been given an old Blacklist bounty by the other Grand Champions of the Great Hunt, but the only details that were provided were coordinates matching the location of Taris and a holofrequency to call when you get there.
Use your ship’s galaxy map to travel to the planet Taris.",Travel to Taris
A Native Speaker,"The Republic has arrived on Balmorra determined to end the Empire’s occupation once and for all. Commander Madine has asked for your help to obtain control of Balmorra’s satellite defense system from the Empire. In order to do that, you’ll need help from Iain Sarkus, a Hawkeye technician familiar with the satellite system.
Iain Sarkus was last seen working for the Empire. Look for Sarkus at Camp Jacent and speak with him.",Find Iain Sarkus
A Native Speaker: Undercover Escape,"The Republic has arrived on Balmorra determined to end the Empire’s occupation once and for all. Commander Madine has asked for your help to obtain control of Balmorra’s satellite defense system from the Empire. In order to do that, you’ll need help from Iain Sarkus, a Hawkeye technician familiar with the satellite system.
With the help of Iain’s remote-controlled droid, you have sabotaged several systems at Camp Jacent in order to create a distraction. Return to the bunker and use the door panel to signal Iain for your escape.",Signal Iain Sarkus
A New Epoch of Fear,"You defeated the Eagle and his terror network, but the Eradicators–the Eagle’s orbital strike weapons–could begin firing randomly on Imperial worlds at any moment. You possess half the command codes needed to deactivate or retarget the Eradicators; the second half is in the hands of the Eagle’s mysterious “patron.”
Intelligence believes this patron may be based in the Artus System. You are to find the Eagle’s patron and obtain his half of the command codes–but before you depart, Darth Zhorrid wishes to speak with you in the Citadel on Dromund Kaas.",Speak to Darth Jadus
A Return Home,"You have found all the Jedi Masters afflicted by the plague, but the Jedi Council has had no luck tracking Lord Vivicar. Until he is found, there will be no way to completely stop the plague.
Master Syo Bakarn has requested you return to Tython and present your findings to the Jedi Council, to help them plan their next move against Lord Vivicar. Use your ship’s galaxy map to plot your course for Tython.",Answer Your Holocom
Acceptable Risk,"Aric Jorgan’s efforts to discover the location of his former squad mates, the Deadeyes, have been partially successful. The first set of coordinates has been decrypted, and indicate that Jorgan’s former XO, Lieutenant Torve, is being held in an Imperial facility on Tatooine. Jorgan has asked you to help him carry out a rescue operation immediately.",Travel to Tatooine
Alderaan: Bonus Series,"Republic Colonel Jace Malcom has asked you to assist House Organa in holding the line against the Empire in the contested valley of King’s Pass. Colonel Malcom received reports of a Killik attack on Organa forces in that area.
Speak with Lieutenant Ross at Wardpost Luurdes and find out how you can help.",Report to Lieutenant Ross
An Extra Blow,Sergeant Jolis wanted to avenge his fallen squadron by destroying the Empire’s anti-aircraft guns and recovering the squad’s databanks. Avenge them further by taking out any Imperials who stand in your way at Camp Jacent.,Defeat Imperial Forces
Artillery Teams,Take out the Republic artillery forces near their cannons in the Brell Sediment to prevent them from repairing the damage your wreak on their weaponry.,Defeat Republic Artillery Forces
Bait,"Risha received a holocall from an old friend named Juran Reb. His wife, Audila, has been kidnapped.
The kidnappers threatened to kill Audila if Risha doesn’t meet them at the Czerka mining complex on Tatooine. Travel to Tatooine so you can save Risha’s friend.",Travel to Tatooine
Barrage,"Centuries ago, a Sith bombardment demolished Taris. Now the Republic rebuilds, and the Empire fights to restore the planet’s ruin. You have allied with Darth Gravus, mastermind of the destruction, to end the Republic resettlement.
For your first strike, annihilate the Republic artillery that bombs the Empire from across the acidic lake.",Destroy the Artillery at Site Alpha
Behind Enemy Lines,"Senator Dodonna has enlisted you as a privateer for the Republic.
The Senator has instructed you to travel to Balmorra, where you will get an update on your current mission from Darmas Pollaran. Use the ship’s galaxy map to travel to Balmorra.",Travel to Balmorra
Blackmail,"You defeated the Eagle and his terror network, but the Eradicators–the Eagle’s orbital strike weapons–remain a threat, along with the Eagle’s mysterious “patron.” Together with Watcher Two, you tracked this “patron” to an Imperial dreadnaught in the Artus System.
On the ship’s bridge, you found Darth Jadus, who has been manipulating events since the beginning. You convinced him that his plan was already doomed, and he agreed to depart; a number of his prisoners, however, remain faithful to his cause. Defend yourself against these crazed prisoners.",Defeat the Crazed Prisoner Leaders
Casualties of War,"Darth Angral has unleashed the Desolator superweapon on the Jedi world Tython. You must stop the Sith before he kills everyone on Tython’s surface.
Defeat Darth Angral’s security forces.",Defeat Angral’s Forces
Chaos on a Broken World,"Your mission to infiltrate the Republic Strategic Information Service and uncover the plans of Ardun Kothe has begun in earnest. You’ve convinced the SIS that you want to work with them and received your first assignment.
Use your ship’s galaxy map to travel to the planet Taris, where you will receive a full briefing.",Travel to Taris
Check In,"Plan Zero is underway. For years, Darth Baras has been tracking the Republic’s top military leaders, and the time has finally come to eliminate them.
Use your ship’s galaxy map to travel to Taris, and prepare for your assault against the Republic leaders.",Travel to Taris
Clearing a Path,"The Republic has arrived on Balmorra determined to end the Empire’s occupation once and for all. Commander Madine has asked for your help to obtain control of Balmorra’s satellite defense system from the Empire. With the help of Hawkeye tech Iain Sarkus, you have a hack that will give the Republic brief control of the satellite system.
All the preparations are in place. It’s time to assault the satellite control tower and face Admiral Riserre.",Confront Admiral Riserre
Comlink Disruption,"As part of your mission aboard the Dorin’s Sky, disrupt communications throughout the ship by disabling Republic comlink relays.",Disable Comlink Relays
Command and Control,"Lord Vivicar has brainwashed Republic forces and bent them to his will. There is only one way to cure their madness.
Defeat the brainwashed Blue, Green and Red Squad Leaders to weaken Lord Vivicar’s grip on his Republic followers.",Defeat the Brainwashed Blue Squad Leader
Dark Science,"A Jedi Master named Oteg recruited you for a top secret mission: Enter the Empire’s impregnable Maelstrom Prison and free a captive Jedi with vital information on the enemy’s plans. First, you must find a way to navigate the Maelstrom Nebula. A Gree supercomputer at the Empire’s fortress on Taral V can make the necessary calculations, but you’ll have to steal it.
As part of your mission to Taral V, demolish Imperial research stations and put an end to whatever dark agenda they advance.",Destroy Imperial Research Stations
Defender of the Empire,"You’ve discovered that Darth Jadus, a man the Empire believed dead, is the mastermind behind the terrorist attacks and the Eradicator orbital weapons. Together with Watcher Two, you tracked him to an Imperial dreadnaught in the Artus System.
To earn Jadus’s confidence and lure him into a trap, you activated the Eradicators. Make this sacrifice worthwhile; sabotage the ship while Jadus is observing the Eradicators’ chaos by destroying the shield generator, jamming signal and hyperdrive.",Disable the Jamming Signal
Disrupting Defenses,"A Jedi Master named Oteg recruited you for a top secret mission: Storm the Empire’s impregnable Maelstrom Prison and free a captive Jedi with vital information on the enemy’s plans.
As part of your mission to Maelstrom Prison, aid the Republic fleet by sabotaging the prison’s defense mechanisms.",Destroy Prison Defense Consoles
Dominating Taris,"Centuries ago, the planet Taris was destroyed by a Sith attack. Since then, the ruins of Taris have stood as a monument to Sith might. But now the Republic is rebuilding their lost world, and the Empire has returned to finish Taris’s destruction.
If you wish to aid the annihilation of Taris, speak to Captain Helid at his command tent within the toxic lake garrison.",Speak with Captain Helid
Eviction Notice,"The search for Jicoln Cadera has led you to the Second Colonial Protectorate, which is guarded by Republic droids. Eliminate them.",Destroy Republic Droids
Extremely Hostile Negotiations,"The crew of the Aurora is alerted to your presence and will stop at nothing to protect Kellian Jarro, the Jedi Master you’ve come to kill.
Thin the crew’s ranks to weaken Kellian Jarro’s defenses.",Defeat Aurora Crew Members
Fate of the Jedi,"General Var Suthra received an emergency alert from Master Satele Shan: Darth Angral is attacking Tython!
Unless you board Darth Angral’s warship and deactivate the Desolator superweapon, the Jedi homeworld will be destroyed! Travel to the Oppressor, Darth Angral’s warship, in the Coreward Worlds to stop his superweapon.",Talk to Darth Angral
Final Stage – Insecticide,"Colicoids, a hostile, insect-like species native to Balmorra, are threatening to overrun the Republic’s beachhead in Bugtown. If their numbers are not thinned, their presence could endanger the Republic’s entire operation to retake the planet.
You have taken out a number of adult Colicoids as well as their eggs and nests. Enter the Colicoid queen’s nest and defeat the queen there in order to end the Colicoid infestation in Bugtown once and for all. Obtain the queen’s carapace as proof of her demise.",Defeat and Search the Colicoid Queen
Final Stage – Pressure Points,"You have been tasked with shutting down an Ulgo military base inside Lerantha Dam. As you make your way through the underground facility, you can strike a further blow by destroying their reactor.
With the pressure valves sealed, you can now take out the main reactor core. Use the reactor control console in the Lerantha Dam Underground to release the pressure and blow the reactor.",Stage 3 – Use the Reactor Control Console
Final Stage – Trade Sanctions,"Camp Jacent is a major Imperial supply base for the Empire in the Markaran Plains. Crippling the base’s operations would strike a major blow for the Balmorran resistance in the area.
You have destroyed major supply shipments and artillery turrets at Camp Jacent, but more supplies are en route. Hack into the Imperial shipping network and divert the approaching supply convoy into resistance-controlled territory.",Divert the Imperial Supply Convoy
Food Chain,"Sergeant Mannes has asked you to help defend the Republic headquarters from the Colicoids, an insect-like native species that gives Bugtown its name.
Taking out the alpha males–the largest, most ferocious of the bugs–would be a good start. Eliminate the Colicoid Patriarchs around Bugtown.",Defeat Colicoid Patriarchs
Forged in Battle,"The Republic knows the value of the Foundry, and has an elite garrison stationed there. Destroy the Republic forces to clear a path to the Jedi Master.",Stage 1 – Defeat Republic Forces
Grummalt’s Conscripts,Captain Grummalt and his Republic conscripts are blocking your path into General Faraire’s compound. Crush them.,Defeat Republic Conscripts
Hail the Conquering Hero,"You should report back to the Mandalorians on Dromund Kaas now that you have concluded the Great Hunt.
Speak to the Huntmaster in the Mandalorian enclave on Dromund Kaas.",Return to Dromund Kaas
Healthy Competition,Thana Vesh has challenged you to a friendly bet. Win the contest by topping her kill count in the Junction as you race to confront Kom Orda.,Eliminate Republic Forces
Heavy Defenses,"You have everything you need to hack into Balmorra’s satellite system, but the Empire isn’t going down without a fight. You’ll have to get through the augmented defenses in and around the satellite control tower first.",Defeat Imperial Forces
Hero of the People,"You’ve discovered that Darth Jadus, a man the Empire believed dead, is the mastermind behind the terrorist attacks and the Eradicator orbital weapons. Together with Watcher Two, you tracked him to an Imperial dreadnaught in the Artus System.
You deactivated the Eradicators, but Darth Jadus is threatening to bring them back online. He is too skilled to defeat in combat, but you may be able to trap him using the ship’s internal ray shielding. Distract Darth Jadus and his guardians by attacking them.",Defeat Darth Jadus
Honor Amongst Thieves,"The Voidwolf’s forces have boarded Port Nowhere and are attacking everyone. If you want to keep your new base of operations, you need to get rid of the Imperials.
Defeat the Imperial forces in the Port Nowhere Cantina.",Rescue Smugglers in the Cantina
Honor Regained,A bounty hunter named Hedarr Soongh contacted you with disturbing news: Tarro Blood’s comrades are meeting to plot your elimination from the Great Hunt. Hedarr Soongh believes Tarro’s intentions to be dishonorable and has provided you with the coordinates of the meeting.,Defeat Sedyn Kyne
Imperial Ambush,Defeat the Imperial soldiers in the Whiterock Wastes.,Defeat the Imperial Soldiers
Inconspicuous Valor,"Harron Tavus’s location has been pinpointed via an intercepted signal broadcast. General Garza wishes to brief you on the full details in person.
Travel to Coruscant and meet with General Garza.",Defeat Wraith
Industrial Sabotage,Security at the Imperial droid factory is programmed to attack all intruders. Destroy all Imperial droids before they interfere with your sabotage.,Destroy Imperial Droids
Inheritance,"You have collected all of the lost artifacts of Tulak Hord. Darth Zash wants you to meet her on Dromund Kaas, so that you can begin the ritual.",Return to Mila Escalus
Insecticide,"Colicoids, a hostile, insect-like species native to Balmorra, are threatening to overrun the Republic’s beachhead in Bugtown. If their numbers are not thinned, their presence could endanger the Republic’s entire operation to retake the planet.
You have taken out a number of adult Colicoids, eggs and nests, as well as defeated the Colicoid queen. Deliver her carapace to the dropbox at Farnel Outpost as proof of her demise.",Deliver the Colicoid Queen’s Carapace
Jungle Infiltration,"You’ve arrived on the hostile jungle world of Taral V, on a mission for Master Oteg. The jungles and waterways surrounding the Imperial outpost are full of dangerous beasts; defeat them to ensure nothing prevents you from completing your mission.",Stage 1 – Defeat Jungle Beasts
Justice,"Harron Tavus’s location has been pinpointed via an intercepted signal broadcast. He’s currently attempting to regroup with his remaining followers in Imperial space. You infiltrated his ship and disabled the hyperdrive.
Now only your primary objective remains. Confront Commander Tavus on the bridge of the Justice.",Speak with General Garza
Legacy,"At last you have gathered the fragments of Tulak Hord’s artifact and are ready to undergo the ritual. Darth Zash has promised that this ritual will give you great power, and that soon, the galaxy will kneel before you.
However, Aloysius Kallig is convinced that Zash will betray you within the Dark Temple and has warned you to prepare yourself for the fight of your life. Return to Dromund Kaas.",Travel to Dromund Kaas
Lives in the Balance,"You have joined a top secret strike team with the objective of capturing the Emperor in his cloaked fortress orbiting Dromund Kaas.
Master Satele Shan has sent you to Balmorra to assist one of your fellow strike team members in a top secret mission. Use your ship’s galaxy map to travel to Balmorra.",Travel to Balmorra
Militia Stomping,"Centuries ago, a Sith attack demolished Taris. Now, the Republic rebuilds. You have allied with Darth Gravus and his irascible apprentice, Thana Vesh, to restore Taris’s ruin. A Republic commander, Kom Orda, is slowing the Empire’s assault, but to reach Orda you must first neutralize a group of hostile colonists.
You have decided to end the Cathar threat through extreme force. Go to their militia training camp in the Brell Sediment and thin the number of Cathar settlers.",Defeat Cathar Settlers
Operation Blackout,Ensure that knowledge of Prellon Garn’s status as a double agent doesn’t reach the Empire. Defeat all Imperial forces present at the emergency landing site on Tatooine.,Defeat All Imperial Forces
OPTIONAL: Stealth Operative,"You have managed to sneak aboard Commander Tavus’ ship under the guise of a Republic soldier joining his cause. If you can avoid raising suspicion, you may be able to complete your objective without raising an alarm.
Your subterfuge won’t succeed without a distraction. Plant an explosive charge on munitions cargo in the hangar of the Justice.",Plant Explosives in the Hangar
Our Points of View,"You have been elected as the Jedi representative to the Rift Alliance, a group of diplomats threatening to leave the Republic. You are to see to their needs and convince them to stay.
One of the diplomats, Tai Cordan, has asked for help freeing his homeworld Balmorra, currently under Imperial occupation. Use your ship’s galaxy map and travel to Balmorra to see what you can do to help.",Report to Tai Cordan
Out of Order,"T6-44 needs to deliver supplies to a Thul outpost, but Killik scavengers stole them before they could be delivered.
Recover the stolen rations, medicine and weapons from the Ukunuku Killik Nest in the Kaamos Territory.",Recover the Stolen Weapons
Painful Employment,"Only the most elite Imperial forces are trusted to guard Maelstrom Prison, but they stand between you and the Jedi Prisoner. Take them down.",Stage 1 – Defeat Imperial Forces
Port Nowhere,"You have unraveled the mystery of Nok Drayen’s fortune and recovered his reliquary from the Long Shadow. His daughter Risha has decided to stay on board as part of your crew.
Use your ship’s meeting console to call a meeting with everybody on board.",When You’re Ready to Return to Duty Use Your Ship’s Intercom
Pressure Points,"The Lerantha Dam in the Juran Mountains has been taken over by House Ulgo, and they are using it to power their war machine.
You’ve put a stop to their operations, however, and discovered a datapad containing valuable intel in the process. Use the facility’s communications console to upload the datapad’s contents to House Thul.",Upload the Intel to House Thul
Raider Retribution,"You have been tasked with recovering medpacks for Organa forces from an Ulgo raiding party responsible for their injuries. Deal an extra blow by taking out any Ulgo forces who try to stop you.
Defeat Ulgo forces at the Ulgo Raiding Camp in King’s Pass.",Defeat Ulgo Forces
Raiding the Nest,Strike a blow against the Eagle’s power base by eliminating his terrorist army in the Eagle’s Nest on Hutta.,Defeat the Eagle’s Terrorists
Rebirth,"With his “shko-yagu” rite well under way, Qyzen is eager to hunt again. Lek Svaal, the young Trandoshan you encountered on Tatooine, has been inviting Qyzen to a once-in-a-lifetime hunting opportunity on Alderaan.
Use your ship’s galaxy map to travel to Alderaan.",Defeat Gwarror and his Henchmen
Recovery Plan,"Damaged Imperial recon droid I-M3 has mistaken you for a member of the Empire. He has informed you of the locations of several downed Imperial fighters that still have their signal transponders intact. With those transponders, the Republic could decode Imperial signals and track the Imperial Navy.
Recover the transponders from the three crash sites in the Markaran Plains.",Recover Shadow Two’s Transponder
Recruitment Drive,"Havoc Squad must reach full strength ASAP in order to carry out an assault on the Empire’s new superweapon, code-named Gauntlet. The squad will need an explosives expert and a technical specialist in order to succeed.
Use your ship’s galaxy map to travel to Balmorra, where you will recruit an explosives expert selected by General Garza.",Travel to Balmorra
Retake the Daybreaker,"Imperials forces have overtaken the Republic medical frigate.
Reduce their numbers to aid the Republic cause.",Defeat Imperial Forces
Return to Duty,"You have received an alert that General Garza is attempting to contact you on your ship’s secure channel.
Return to your ship and contact General Garza on the holoterminal.",When You’re Ready to Return to Duty Use Your Ship’s Holoterminal
Ruined Ransom,"You have discovered House Rist is holding members of House Thul captive in their main compound in the Juran Mountains. As you work to erase Imperial names from their target database, assist your allies by freeing any Thul captives you find.
Release Thul prisoners from the prison cells in House Rist in the Juran Mountains.",Release Thul Prisoners
Set the Table,"Following your defeat of Nomen Karr and your recruitment of his Padawan, Darth Baras granted you the title of Sith Lord and offered you a respite from your duties. But a warrior never rests for long.
Speak to Darth Baras via your ship’s holoterminal to begin the next phase of your journey.",Use Your Ship’s Holoterminal
Sith Hierarchy,"With the events in the Dark Temple behind you, it is time to start setting up your affairs as Darth Zash’s successor.
Go to Darth Zash’s office in the Sith Sanctum on Dromund Kaas, and use the holocall unit there.",Go to Darth Zash’s Office
